,Unnamed: 0,Date,Source,Headline,Content,Headline_sentiment,Content_sentiment
79,79,2023-10-13 13:38:08,Biztoc.com,"Novo Nordisk raises full-year guidance again as U.S. sales of Wegovy, Ozempic fly",FILE PHOTO: Flags with the Novo Nordisk logo flutter outside their Danish company's offices in CopenhagenCOPENHAGEN (Reuters) -Novo Nordisk on Friday raised its outlook for its full-year sales and op… [+283 chars],0.0,0.0
80,80,2023-10-10 21:02:39,Investor's Business Daily,WW Stock Soars To High. New Weight-Loss Drug Play Enjoys Oprah Winfrey Effect.,"WW International (WW) continues to sizzle after board member Oprah Winfrey clarified that she didn't mean to diss weight-loss drugs. Formerly WeightWatchers, WW stock broke out Tuesday.
XOver the we… [+2286 chars]",-0.08333333333333333,-0.16
81,81,2023-10-03 09:39:45,Marketscreener.com,Novo Holdings CEO says IPO window to open within 18 months,"COPENHAGEN, Oct 3 (Reuters) - The CEO of Novo Holdings,
the controlling shareholder in drugmaker Novo Nordisk
, said on Tuesday he sees the window for initial
public offerings (IPOs) opening withi… [+580 chars]",0.0,0.0
82,82,2023-10-16 10:45:00,Scientific American,"Should Insurance Cover Wegovy, Ozempic and Other New Weight-Loss Drugs?","Pamela Torres used to run a seven-minute mile. But when the former track star suffered a severe knee injury in college, she began to rapidly gain weight. She was diagnosed with type 2 diabetes in her… [+11983 chars]",-0.42857142857142855,-0.16
83,83,2023-10-02 20:58:07,Investing.com,"US Patent Office won't review two Novo Nordisk patents for Wegovy, Ozempic","By Blake Brittain
WASHINGTON (Reuters) - A U.S. Patent Office tribunal on Monday rejected challenges to two key patents owned by Novo Nordisk (NYSE:NVO) covering the active ingredient in its weight-… [+1506 chars]",0.0,0.0
84,84,2023-10-16 14:37:38,Investing.com,Novo Nordisk Expands Portfolio With $1.3 Billion Acquisition of KBP's Hypertension Drug,"Global healthcare firm Novo Nordisk (NYSE:NVO) is set to acquire the hypertension drug, Ocedurenone, from KBP Biosciences for approximately $1.3 billion, according to reports on Monday. This strategi… [+2248 chars]",0.09090909090909091,0.0
85,85,2023-10-05 16:05:07,Investing.com,Study says Novo Nordisk weight-loss drugs linked increased risk of bowel issues,"Bloomberg said in an article Thursday that findings published in the JAMA medical journal show Novo Nordisk (NYSE:NVO) A/S drugs, commonly used for weight loss, have been linked to an increased risk … [+784 chars]",-0.36363636363636365,-0.15384615384615385
86,86,2023-10-13 13:01:16,Investing.com,"Novo Nordisk gains after boosting 2023 outlook on Ozempic, Wegovy sales surge","Novo Nordisk (NYSE:NVO) gained 2% in pre-open trading Friday after raising its sales and earnings outlook for the year amid robust growth of weight loss drugs Ozempic and Wegovy.
The company now see… [+584 chars]",0.3,0.11538461538461539
87,87,2023-10-13 15:48:01,Investing.com,Novo Nordisk Revises Full-Year Guidance on Robust US Drug Sales,"Novo Nordisk (NYSE:NVO), currently the most valuable European company, has revised its full-year guidance upwards, primarily due to a surge in U.S. sales of its semaglutide-based drugs, Wegovy and Oz… [+1657 chars]",0.2222222222222222,0.0
88,88,2023-10-13 12:29:07,Marketscreener.com,NOVO NORDISK : Deutsche Bank reiterates its Buy rating,"Novo Nordisk Halts Ozempic Study
October 11, 2023 at 10:47 am EDT",0.0,0.0
89,89,2023-10-13 21:04:15,Biztoc.com,This Is What Whales Are Betting On Novo Nordisk,A whale with a lot of money to spend has taken a noticeably bullish stance on Novo Nordisk.Looking at options history for Novo Nordisk NVO we detected 51 strange trades.If we consider the specifics o… [+261 chars],0.0,-0.041666666666666664
90,90,2023-10-09 10:10:05,Marketscreener.com,NOVO NORDISK : Deutsche Bank reaffirms its Buy rating,"NOVO NORDISK : Taking into account the stock split 
September 13, 2023 at 03:46 am EDT",0.0,0.0
91,91,2023-10-12 17:22:07,Biztoc.com,DaVita plays down Ozempic’s potential in treating kidney disease,Dialysis company DaVita Inc. issued a statement on Thursday in response to the news Wednesday from Novo Nordisk that its Ozempic treatment for Type 2 diabetes delayed the progression of chronic kidne… [+315 chars],-0.125,-0.043478260869565216
92,92,2023-10-11 13:49:04,Biztoc.com,Novo Nordisk Pops After Hinting Weight-Loss Drug Also Treats Kidney Disease,Novo Nordisk stock popped Wednesday after the company hinted its weight-loss drug showed early promise in kidney disease treatment.The post Novo Nordisk Pops After Hinting Weight-Loss Drug Also Treat… [+125 chars],-0.4,-0.23076923076923078
93,93,2023-10-13 15:32:17,Biztoc.com,"Stock Market Rallies, Hits Resistance; Novo Nordisk, JPMorgan, Exxon In Focus: Weekly Review","The major indexes rallied for the week, but hit resistance at key levels amid weak stock market breadth. Novo Nordisk, JPMorgan, Exxon were in focus.The post Stock Market Rallies, Hits Resistance; No… [+193 chars]",0.0,-0.1111111111111111
94,94,2023-10-02 22:10:05,Biztoc.com,"US Patent Office won't review two Novo Nordisk patents for Wegovy, Ozempic",FILE PHOTO: Flags with the Novo Nordisk logo flutter outside their Danish company's offices in CopenhagenWASHINGTON (Reuters) - A U.S. Patent Office tribunal on Monday rejected challenges to two key … [+314 chars],0.0,-0.038461538461538464
95,95,2023-10-11 17:48:17,Biztoc.com,"Stocks making the biggest moves midday: Novo Nordisk, DaVita, Exxon Mobil, Amgen and more","A box of Ozempic, a semaglutide injection drug used for treating Type 2 diabetes made by Novo Nordisk.Novo Nordisk The Danish drugmaker stock added 5.5% after saying late Tuesday it was halting Ozemp… [+302 chars]",0.0,0.0
96,96,2023-10-11 16:50:08,Biztoc.com,What's Going On With Eli Lilly Stock Wednesday?,Eli Lilly And Co LLY shares are trading higher Wednesday. The stock appears to be moving alongside Novo Nordisk NVO shares after the drugmaker halted trials on early signs of efficiency.What Happened… [+296 chars],0.0,0.08
97,97,2023-10-16 11:00:00,GlobeNewswire,Novo Nordisk to acquire ocedurenone for uncontrolled hypertension from KBP Biosciences,"Bagsværd, Denmark and Singapore, 16 October 2023 Novo Nordisk A/S and KBP Biosciences PTE., Ltd. today announced that Novo Nordisk has agreed to acquire ocedurenone for uncontrolled hypertension with… [+8561 chars]",0.0,0.04
98,98,2023-10-14 05:14:15,Biztoc.com,"Novo Nordisk Ups Outlook Amid Surging Demand For Weight Loss Drug Wegovy, Ozempic","Following a surge in demand for its weight-loss drug Wegovy and diabetes medication Ozempic, Danish pharmaceutical company Novo Nordisk NVO has revised its full-year sales and operating profit outloo… [+308 chars]",-0.3333333333333333,-0.08695652173913043
99,99,2023-10-09 11:12:16,Biztoc.com,"Obesity Drug Boom, Split Make This Stock a Heavy Bargain","This premium article is available to MarketBeat All Access subscribers only. Log in to your account or sign up below. Already have an account? Log in here.Should you invest $1,000 in Novo Nordisk A/S… [+280 chars]",0.25,0.0
